Tue Sep 17 12:45:58 2019: Starting Initialization


Mini-Application Name    : CoMD-cuda-mpi
Mini-Application Version : 1.1
Platform:
  hostname: n01
  kernel name: 'Linux'
  kernel release: '5.0.16-100.fc28.x86_64'
  processor: 'x86_64'
Build:
  CC: '/usr/lib64/openmpi/bin/mpicc'
  compiler version: 'gcc (GCC) 7.4.0'
  CFLAGS: '-std=c99 -Wno-unused-result -DMAXATOMS=64  -DNDEBUG -g -O5 -DCOMD_DOUBLE -DDO_MPI   -I/usr/local/cuda-10.0/include'
  LDFLAGS: ' -lm -lstdc++ -L/usr/local/cuda-10.0/lib64 -lcudart'
  using MPI: true
  Threading: none
  Double Precision: true
Run Date/Time: 2019-09-17, 12:45:58

Command Line Parameters:
  doeam: 1
  potDir: pots
  potName: Cu_u6.eam
  potType: funcfl
  nx: 100
  ny: 100
  nz: 80
  xproc: 1
  yproc: 1
  zproc: 1
  Lattice constant: -1 Angstroms
  nSteps: 100
  printRate: 10
  Time step: 1 fs
  Initial Temperature: 600 K
  Initial Delta: 0 Angstroms

  GPU async opt: 0
  GPU profiling mode: 0
  GPU method: thread_atom
  Space-filling (Hilbert): 0

Host n01 using GPU 0: TITAN Xp

Simulation data: 
  Total atoms        : 3200000
  Min global bounds  : [   0.0000000000,   0.0000000000,   0.0000000000 ]
  Max global bounds  : [ 361.5000000000, 361.5000000000, 289.2000000000 ]

Decomposition data: 
  Processors         :      1,     1,     1
  Local boxes        :     73,    73,    58 =   309082
  Box size           : [   4.9520547945,   4.9520547945,   4.9862068966 ]
  Box factor         : [   1.0004151100,   1.0004151100,   1.0073145246 ] 
  Max Link Cell Occupancy: 14 of 64

Potential data: 
  Potential type  : EAM
  Species name    : Cu
  Atomic number   : 29
  Mass            : 63.55 amu
  Lattice type    : FCC
  Lattice spacing : 3.615 Angstroms
  Cutoff          : 4.95 Angstroms

Memory data: 
  Intrinsic atom footprint =   88 B/atom 
  Total atom footprint     = 268.555 MB (268.55 MB/node)
  Link cell atom footprint = 1660.108 MB/node
  Link cell atom footprint = 1812.744 MB/node (including halo cell data


Initial energy : -3.460523233087, atom count : 3200000 

Tue Sep 17 12:46:04 2019: Initialization Finished

Tue Sep 17 12:46:04 2019: Starting simulation

#                                                                                         Performance
#  Loop   Time(fs)       Total Energy   Potential Energy     Kinetic Energy  Temperature   (us/atom)     # Atoms
      0       0.00    -3.460523233087    -3.538079224687     0.077555991600     600.0000     0.0000      3200000
     10      10.00    -3.460522626045    -3.529932317684     0.069409691639     536.9774     0.1038      3200000
     20      20.00    -3.460524214625    -3.509749668212     0.049225453588     380.8252     0.1053      3200000
     30      30.00    -3.460527797950    -3.488547028337     0.028019230386     216.7665     0.1065      3200000
     40      40.00    -3.460532211902    -3.477551230182     0.017019018280     131.6650     0.1075      3200000
     50      50.00    -3.460536506225    -3.479809798208     0.019273291984     149.1049     0.1081      3200000
     60      60.00    -3.460538213362    -3.488992622872     0.028454409511     220.1332     0.1083      3200000
     70      70.00    -3.460536805682    -3.496684322697     0.036147517015     279.6497     0.1084      3200000
     80      80.00    -3.460533990379    -3.498962548136     0.038428557758     297.2966     0.1086      3200000
     90      90.00    -3.460531480700    -3.497327730471     0.036796249771     284.6685     0.1088      3200000
    100     100.00    -3.460530069622    -3.495812505678     0.035282436056     272.9571     0.1087      3200000
Tue Sep 17 12:46:39 2019: Ending simulation



Simulation Validation:
  Initial energy  : -3.460523233087
  Final energy    : -3.460530069622
  eFinal/eInitial : 1.000002
  Final atom count : 3200000, no atoms lost


Timings for Rank 0
        Timer        # Calls    Avg/Call (s)   Total (s)    % Loop
___________________________________________________________________
total                      1      40.2286       40.2286      117.03
loop                       1      34.3732       34.3732      100.00
timestep                  10       3.4370       34.3698       99.99
  position               100       0.0000        0.0005        0.00
  velocity               200       0.0000        0.0009        0.00
  redistribute           101       0.1298       13.1141       38.15
    atomHalo             101       0.0048        0.4812        1.40
  force                  101       0.1991       20.1116       58.51
    eamHalo              101       0.1991       20.1101       58.51
commHalo                 606       0.0004        0.2147        0.62
commReduce                39       0.0000        0.0001        0.00

Timing Statistics Across 1 Ranks:
        Timer        Rank: Min(s)       Rank: Max(s)      Avg(s)    Stdev(s)
_____________________________________________________________________________
total                0:   40.2286       0:   40.2286     40.2286      0.0000
loop                 0:   34.3732       0:   34.3732     34.3732      0.0000
timestep             0:   34.3698       0:   34.3698     34.3698      0.0000
  position           0:    0.0005       0:    0.0005      0.0005      0.0000
  velocity           0:    0.0009       0:    0.0009      0.0009      0.0000
  redistribute       0:   13.1141       0:   13.1141     13.1141      0.0000
    atomHalo         0:    0.4812       0:    0.4812      0.4812      0.0000
  force              0:   20.1116       0:   20.1116     20.1116      0.0000
    eamHalo          0:   20.1101       0:   20.1101     20.1101      0.0000
commHalo             0:    0.2147       0:    0.2147      0.2147      0.0000
commReduce           0:    0.0001       0:    0.0001      0.0001      0.0000

---------------------------------------------------
 Average atom update rate:       0.11 us/atom/task
---------------------------------------------------


---------------------------------------------------
 Average all atom update rate:   0.11 us/atom
---------------------------------------------------


---------------------------------------------------
 Average atom rate:              9.31 atoms/us
---------------------------------------------------

Tue Sep 17 12:46:39 2019: CoMD Ending

41345
start time: 12:45:58
