Tue Sep 17 14:29:51 2019: Starting Initialization


Mini-Application Name    : CoMD-cuda-mpi
Mini-Application Version : 1.1
Platform:
  hostname: n01
  kernel name: 'Linux'
  kernel release: '5.0.16-100.fc28.x86_64'
  processor: 'x86_64'
Build:
  CC: '/usr/lib64/openmpi/bin/mpicc'
  compiler version: 'gcc (GCC) 7.4.0'
  CFLAGS: '-std=c99 -Wno-unused-result -DMAXATOMS=64  -DNDEBUG -g -O5 -DCOMD_DOUBLE -DDO_MPI   -I/usr/local/cuda-10.0/include'
  LDFLAGS: ' -lm -lstdc++ -L/usr/local/cuda-10.0/lib64 -lcudart'
  using MPI: true
  Threading: none
  Double Precision: true
Run Date/Time: 2019-09-17, 14:29:51

Command Line Parameters:
  doeam: 1
  potDir: pots
  potName: Cu_u6.eam
  potType: funcfl
  nx: 100
  ny: 100
  nz: 80
  xproc: 1
  yproc: 1
  zproc: 1
  Lattice constant: -1 Angstroms
  nSteps: 100
  printRate: 10
  Time step: 1 fs
  Initial Temperature: 600 K
  Initial Delta: 0 Angstroms

  GPU async opt: 0
  GPU profiling mode: 0
  GPU method: thread_atom
  Space-filling (Hilbert): 0

Host n01 using GPU 0: TITAN Xp

Simulation data: 
  Total atoms        : 3200000
  Min global bounds  : [   0.0000000000,   0.0000000000,   0.0000000000 ]
  Max global bounds  : [ 361.5000000000, 361.5000000000, 289.2000000000 ]

Decomposition data: 
  Processors         :      1,     1,     1
  Local boxes        :     73,    73,    58 =   309082
  Box size           : [   4.9520547945,   4.9520547945,   4.9862068966 ]
  Box factor         : [   1.0004151100,   1.0004151100,   1.0073145246 ] 
  Max Link Cell Occupancy: 14 of 64

Potential data: 
  Potential type  : EAM
  Species name    : Cu
  Atomic number   : 29
  Mass            : 63.55 amu
  Lattice type    : FCC
  Lattice spacing : 3.615 Angstroms
  Cutoff          : 4.95 Angstroms

Memory data: 
  Intrinsic atom footprint =   88 B/atom 
  Total atom footprint     = 268.555 MB (268.55 MB/node)
  Link cell atom footprint = 1660.108 MB/node
  Link cell atom footprint = 1812.744 MB/node (including halo cell data


Initial energy : -3.460523233087, atom count : 3200000 

Tue Sep 17 14:29:57 2019: Initialization Finished

Tue Sep 17 14:29:57 2019: Starting simulation

#                                                                                         Performance
#  Loop   Time(fs)       Total Energy   Potential Energy     Kinetic Energy  Temperature   (us/atom)     # Atoms
      0       0.00    -3.460523233087    -3.538079224687     0.077555991600     600.0000     0.0000      3200000
     10      10.00    -3.460522626045    -3.529932317684     0.069409691639     536.9774     0.1278      3200000
     20      20.00    -3.460524214625    -3.509749668212     0.049225453588     380.8252     0.1296      3200000
     30      30.00    -3.460527797950    -3.488547028337     0.028019230386     216.7665     0.1312      3200000
     40      40.00    -3.460532211902    -3.477551230182     0.017019018280     131.6650     0.1325      3200000
     50      50.00    -3.460536506225    -3.479809798208     0.019273291984     149.1049     0.1329      3200000
     60      60.00    -3.460538213362    -3.488992622872     0.028454409511     220.1332     0.1333      3200000
     70      70.00    -3.460536805682    -3.496684322697     0.036147517015     279.6497     0.1338      3200000
     80      80.00    -3.460533990379    -3.498962548136     0.038428557758     297.2966     0.1337      3200000
     90      90.00    -3.460531480700    -3.497327730471     0.036796249771     284.6685     0.1338      3200000
    100     100.00    -3.460530069622    -3.495812505678     0.035282436056     272.9571     0.1339      3200000
Tue Sep 17 14:30:39 2019: Ending simulation



Simulation Validation:
  Initial energy  : -3.460523233087
  Final energy    : -3.460530069622
  eFinal/eInitial : 1.000002
  Final atom count : 3200000, no atoms lost


Timings for Rank 0
        Timer        # Calls    Avg/Call (s)   Total (s)    % Loop
___________________________________________________________________
total                      1      48.2589       48.2589      114.02
loop                       1      42.3255       42.3255      100.00
timestep                  10       4.2319       42.3192       99.99
  position               100       0.0000        0.0004        0.00
  velocity               200       0.0000        0.0009        0.00
  redistribute           101       0.1587       16.0289       37.87
    atomHalo             101       0.0048        0.4833        1.14
  force                  101       0.2462       24.8675       58.75
    eamHalo              101       0.2462       24.8659       58.75
commHalo                 606       0.0004        0.2123        0.50
commReduce                39       0.0000        0.0002        0.00

Timing Statistics Across 1 Ranks:
        Timer        Rank: Min(s)       Rank: Max(s)      Avg(s)    Stdev(s)
_____________________________________________________________________________
total                0:   48.2589       0:   48.2589     48.2589      0.0000
loop                 0:   42.3255       0:   42.3255     42.3255      0.0000
timestep             0:   42.3192       0:   42.3192     42.3192      0.0000
  position           0:    0.0004       0:    0.0004      0.0004      0.0000
  velocity           0:    0.0009       0:    0.0009      0.0009      0.0000
  redistribute       0:   16.0289       0:   16.0289     16.0289      0.0000
    atomHalo         0:    0.4833       0:    0.4833      0.4833      0.0000
  force              0:   24.8675       0:   24.8675     24.8675      0.0000
    eamHalo          0:   24.8659       0:   24.8659     24.8659      0.0000
commHalo             0:    0.2123       0:    0.2123      0.2123      0.0000
commReduce           0:    0.0002       0:    0.0002      0.0002      0.0000

---------------------------------------------------
 Average atom update rate:       0.13 us/atom/task
---------------------------------------------------


---------------------------------------------------
 Average all atom update rate:   0.13 us/atom
---------------------------------------------------


---------------------------------------------------
 Average atom rate:              7.56 atoms/us
---------------------------------------------------

Tue Sep 17 14:30:40 2019: CoMD Ending

49410
start time: 14:29:51
